{
  "schema_version": 3,
  "id": "review-example",
  "target": {
    "commit": null,
    "worktree": "尚未确认"
  },
  "sources": {},
  "pages": {},
  "source_reviewed_at": null,
  "reader": {
    "isolation": "unavailable",
    "description": "尚未安排独立阅读"
  },
  "scenarios": [],
  "not_applicable": {},
  "prepared_at": null,
  "source_review": {
    "status": "pending",
    "isolation": "unavailable",
    "context": "unavailable",
    "description": "尚未独立核对源码答案与不适用理由",
    "input_fingerprint": null,
    "findings": []
  }
}
